counter,nid,content langcode,title,body,misc,tid,taxonomy reference,term langcode
1,152,en,Sed,Abico consectetuer decet haero humo melior os. Cogo dignissim feugiat meus te ut vereor. Causa iaceo lucidus nulla occuro pertineo populus quidem. Importunus melior modo mos tum wisi.,Abbas brevitas decet elit meus nostrud ratis suscipit. Camur eros huic laoreet pala sed validus verto. Acsi cui esca in. Accumsan commodo diam nutus pala quidem sagaciter vulpes. Abico ea genitus neque nutus secundum sed vel. Augue ideo quidem.,215,Mexico,en
2,148,en,Ut,Distineo elit exerci scisco utrum virtus volutpat. Ille patria virtus. Abigo facilisis gravis olim refero suscipere. Adipiscing causa consectetuer et gemino hendrerit ideo pecus turpis ut. Diam ea fere humo ideo melior molior occuro pala probo. Genitus iusto iustum melior praemitto venio.,Iriure metuo meus plaga rusticus sino. Jugis obruo refero singularis. Decet eligo euismod iusto minim scisco te vel. Gemino ille imputo in minim tamen vel vicis.,213,Russia,en
3,147,en,Appellatio Utrum,Accumsan capto nibh validus vero wisi. Feugiat proprius tation. Commodo consequat incassum magna ratis sagaciter. Commoveo consequat dolore fere gravis macto metuo premo vicis. Consequat illum refoveo roto typicus. Capto cui et praemitto vereor. Iaceo inhibeo iustum mos nimis occuro si. Nunc populus vulpes. Feugiat modo proprius.,Gilvus gravis humo jugis pala quis refero typicus valetudo. Inhibeo patria praemitto singularis zelus. At cui eum humo minim pecus quae quis saluto ulciscor. Elit facilisi fere feugiat gemino haero saepius turpis voco. Antehabeo aptent eu eum ibidem iustum nutus sit sudo. Eu haero loquor modo sed.,216,England,en
4,151,en,Augue,Loquor luptatum minim. Abbas aliquip ex ibidem in ratis volutpat. Macto magna singularis. Acsi cui defui feugiat jus obruo saluto sino ullamcorper ut. Camur euismod hos nostrud quadrum scisco tincidunt. Et illum lucidus nulla praemitto ratis ulciscor venio vulpes.,Diam imputo odio persto vindico. Abigo autem decet enim exputo laoreet nibh roto tincidunt typicus. Abdo dolore eligo lobortis mauris meus pneum quae vulputate. At capto damnum euismod gilvus ideo jumentum magna secundum ut. Aptent nimis nunc tum vereor. Accumsan dignissim fere nulla nutus pneum premo sagaciter ut.,213,Russia,en
5,152,es,Sin embargo,"Abico hidrógeno haero crecer mejor se adapta al hueso. Fútbol comprimido eu es que me temo. La causa del brillo de la gente nulla occuro pertinente, de hecho, miento. El mejor cliente de Importunus puede entonces hervir a fuego lento.",El desarrollador de adaptadores cortos de Abbas es emocionante. Peanut se enganchó a Laoreet tum pero es capaz de girar. Como si aquel para quien no es comida en el. La ganancia de capa y el asentimiento financiero son zorros precisos. Abico los que aún no han nacido o el cabeceo. Incluso propaganda.,215,Mexico,es
6,148,es,Afuera,"Los desarrolladores de Distineo preguntan si ejercen problemas de energía. Tiene el poder del país. Una vez que la respuesta seria tarea fácil abigo. Por lo tanto, la causa del rebaño, consectetuer adipiscing hendrerit High School, ya que se basa en dos tipos. Diámetro de tal construcción mejor terreno para que occuro pala lo apruebe. Mejor praemitto regular generado.","Patria teme que permita el ictus rural. Jugis obruo responde individualmente. El rendimiento debe elegir solo preguntarte o extraño. Sin embargo, incluso en el tiempo de imputo gemelo más pequeño.",213,Rusia,es
7,147,es,Si la apelación,"Fuerte, sin embargo, la captura de nibh accumsan wisi. Vel permanente normal. Commodo consequat en vano, gran nave y precisión. Casi todo el tiempo tengo miedo al dolor premo commoveo consequat gravis macto. Receta símbolo refoveo roto. Una vez capturado, a quien también praemitto tengo miedo. Iaceo inhibeo demasiado occuro si se quiere. Ahora la gente es zorra. Vel de manera adecuada.","Los símbolos rotos de tierra grave, continente, se refieren a cualquier condición. Roto country praemitto celo particular. Pero el rebaño del que uno tiene que preguntarse de quién fue el polvo, saludo ulciscor. Casi llamo a un feugiat facilisis turpis elit twin haero con más frecuencia. Antehabeo aptent fútbol lugar adecuado para cabecear el Sudo. Eu haero pero habla.",216,Inglaterra,es
8,151,es,propaganda,"Me pregunto luptatum. Abbas aliquip del barco en el mismo lugar de la carrera. Esca gran individual. Como si aquel a quien el derecho de obruo saludo permitiendo el defui feugiat ullamcorper ut. Cuadrado, pregúnteles nostrud camur euismod tincidunt. Y no es la luz que viene praemitto balsa ulciscor zorros.","Diam imputo odio persto propio. Paratus es adecuado para el símbolo de los desarrolladores de exputo laoreet roto. Mi dolor, elijo lobortis mauris consectetuer abdo which pneum. Pero, de acuerdo con la captura de una gran bestia, por lo tanto, la pérdida de euismod gilvus. Diam tiene mucho miedo de vez en cuando. Accumsan dignissim pneum premo asentir sabiamente, como si fuera casi ninguno.",213,Rusia,es
